{
  "claims": [
    {
      "id": "claim-1",
      "text": "The table contains 1000 rows and 4 columns.",
      "evidence": ["f1:table@shape#base"]
    }
  ],
  "evidence": ["f1:table@shape#base"],
  "warnings": [],
  "requests": [
    {
      "fieldId": "f1:table@sample#k10",
      "level": 1,
      "budget": 300,
      "reason": "Inspect two sample rows for a concrete example."
    }
  ]
}
